{
  "personal": {
    "firstName": "John",
    "lastName": "Doe",
    "initials": "JD",
    "gender": "male",
    "avatarIndex": 1,
    "customPhotoPath": null,
    "title": "Full Stack Developer",
    "subtitle": "Professional Engineer",
    "email": "john@example.com",
    "phone": "+1 (555) 123-4567",
    "location": "San Francisco, CA",
    "education": "BSc in Computer Science",
    "resumeUrl": "",
    "bio": "Passionate full-stack engineer building scalable web applications."
  },

  "social": {
    "github": "",
    "linkedin": "",
    "twitter": "",
    "instagram": "",
    "codepen": "",
    "behance": ""
  },

  "projects": [
    {
      "id": 1,
      "title": "E-Commerce Platform",
      "category": "Full Stack Application",
      "description": "Full-stack SaaS platform for online stores with real-time analytics.",
      "image": "/images/project1.png",
      "tags": ["React", "Node.js", "MongoDB"],
      "link": "",
      "liveDemo": ""
    },
    {
      "id": 2,
      "title": "AI Chat Dashboard",
      "category": "AI Application",
      "description": "Interactive dashboard for managing AI conversations.",
      "image": "/images/project2.png",
      "tags": ["React", "TypeScript", "WebSocket"],
      "link": "",
      "liveDemo": ""
    }
  ],

  "skills": {
    "frontend": ["React.js", "TypeScript", "Next.js", "Tailwind CSS"],
    "backend": ["Node.js", "Express", "MongoDB", "PostgreSQL"],
    "tools": ["Git", "Docker", "AWS", "VS Code"]
  },

  "experience": [
    {
      "company": "Tech Company Inc",
      "position": "Senior Developer",
      "duration": "2023 - Present",
      "description": "Led development of customer-facing applications.",
      "skills": ["React", "Node.js", "AWS"]
    }
  ],

  "about": {
    "headline": "Building Digital Experiences",
    "description": "I'm a full-stack developer with 5+ years of experience.",
    "achievements": ["100+ Projects", "50+ Happy Clients", "5+ Years Experience"]
  },

  "contact": {
    "headline": "Let's Work Together",
    "description": "Have a project in mind? Let's collaborate.",
    "buttonText": "Get In Touch",
    "ctaEmail": "your-email@example.com"
  },

  "deployment": {
    "type": "github-pages",
    "repository": "your-username/portfolio"
  }
}
